{
  "format": "openterface.gamepad.layout.v1",
  "layout": {
    "backgroundFillArgb": -1515563,
    "backgroundOffsetX": 0.0,
    "backgroundOffsetY": 0.0,
    "backgroundPattern": "dots",
    "backgroundScale": 1.0,
    "mouseSensitivity": 1.0,
    "showTwoButtons": false
  },
  "meta": {
    "displayName": "Default",
    "exportedAt": "2026-05-08T12:44:54Z",
    "id": "preset_default",
    "sourceAppVersion": "0.14"
  },
  "modules": [
    {
      "anchorX": 0.2,
      "anchorY": 0.5,
      "dpadCrossArmDecoration": "labels",
      "dpadVariant": "cross",
      "id": "stick_left",
      "moduleAccentArgb": -13154481,
      "scale": 1.72,
      "stickDownKey": 22,
      "stickLeftKey": 4,
      "stickRightKey": 7,
      "stickUpKey": 26,
      "type": "DPAD",
      "zIndex": 0
    },
    {
      "anchorX": 0.7164794,
      "anchorY": 0.51415855,
      "buttonCornerRadiusNorm": 1.0,
      "displayLabel": "B",
      "displayLabelColorArgb": -1,
      "hidKey": 40,
      "id": "button_a",
      "modifierMask": 0,
      "moduleAccentArgb": -43230,
      "scale": 1.41,
      "type": "BUTTON",
      "zIndex": 1
    },
    {
      "anchorX": 0.43033707,
      "anchorY": 0.8333252,
      "buttonCornerRadiusNorm": 0.51,
      "buttonHeightRatio": 0.62,
      "buttonRotationDeg": -35.0,
      "buttonWidthRatio": 1.39,
      "displayLabel": "Select",
      "hidKey": 20,
      "id": "button_select",
      "modifierMask": 0,
      "scale": 0.75,
      "type": "BUTTON",
      "zIndex": 3
    },
    {
      "anchorX": 0.57340825,
      "anchorY": 0.8274919,
      "buttonCornerRadiusNorm": 0.51,
      "buttonHeightRatio": 0.62,
      "buttonRotationDeg": -35.0,
      "buttonWidthRatio": 1.39,
      "displayLabel": "Start",
      "hidKey": 8,
      "id": "button_start",
      "modifierMask": 0,
      "scale": 0.75,
      "type": "BUTTON",
      "zIndex": 4
    },
    {
      "anchorX": 0.85355806,
      "anchorY": 0.5124919,
      "buttonCornerRadiusNorm": 1.0,
      "displayLabel": "A",
      "hidKey": 44,
      "id": "button_b",
      "modifierMask": 0,
      "moduleAccentArgb": -1499549,
      "scale": 1.41,
      "type": "BUTTON",
      "zIndex": 6
    }
  ],
  "schemaVersion": 8
}