{
  "format": "openterface.gamepad.layout.v1",
  "layout": {
    "backgroundFillArgb": -12767670,
    "backgroundOffsetX": 0.0,
    "backgroundOffsetY": 0.0,
    "backgroundPattern": "diagonal_hatch",
    "backgroundScale": 1.0,
    "mouseSensitivity": 1.0,
    "showTwoButtons": false
  },
  "meta": {
    "displayName": "XYAB",
    "exportedAt": "2026-05-08T12:45:00Z",
    "id": "preset_pack_xyab",
    "sourceAppVersion": "0.14"
  },
  "modules": [
    {
      "anchorX": 0.2,
      "anchorY": 0.5,
      "dpadCrossArmDecoration": "labels",
      "dpadVariant": "cross",
      "id": "stick_left",
      "moduleAccentArgb": -13154481,
      "scale": 1.23,
      "stickDownKey": 22,
      "stickLeftKey": 4,
      "stickRightKey": 7,
      "stickUpKey": 26,
      "type": "DPAD",
      "zIndex": 0
    },
    {
      "anchorX": 0.795,
      "anchorY": 0.388,
      "buttonCornerRadiusNorm": 1.0,
      "displayLabel": "Y",
      "hidKey": 24,
      "id": "button_y",
      "mappedKeyLabelVisible": false,
      "modifierMask": 0,
      "moduleAccentArgb": -20443,
      "scale": 0.91,
      "type": "BUTTON",
      "zIndex": 1
    },
    {
      "anchorX": 0.688,
      "anchorY": 0.515,
      "buttonCornerRadiusNorm": 1.0,
      "displayLabel": "X",
      "hidKey": 11,
      "id": "button_x",
      "mappedKeyLabelVisible": false,
      "modifierMask": 0,
      "moduleAccentArgb": -14575807,
      "scale": 0.91,
      "type": "BUTTON",
      "zIndex": 2
    },
    {
      "anchorX": 0.902,
      "anchorY": 0.515,
      "buttonCornerRadiusNorm": 1.0,
      "displayLabel": "B",
      "hidKey": 12,
      "id": "button_b",
      "mappedKeyLabelVisible": false,
      "modifierMask": 0,
      "moduleAccentArgb": -43230,
      "scale": 0.91,
      "type": "BUTTON",
      "zIndex": 3
    },
    {
      "anchorX": 0.795,
      "anchorY": 0.642,
      "buttonCornerRadiusNorm": 1.0,
      "displayLabel": "A",
      "hidKey": 13,
      "id": "button_a",
      "mappedKeyLabelVisible": false,
      "modifierMask": 0,
      "moduleAccentArgb": -11684126,
      "scale": 0.91,
      "type": "BUTTON",
      "zIndex": 4
    },
    {
      "anchorX": 0.43033707,
      "anchorY": 0.8333252,
      "displayLabel": "Select",
      "hidKey": 20,
      "id": "button_select",
      "modifierMask": 0,
      "scale": 0.53,
      "type": "BUTTON",
      "zIndex": 5
    },
    {
      "anchorX": 0.57340825,
      "anchorY": 0.8274919,
      "displayLabel": "Start",
      "hidKey": 8,
      "id": "button_start",
      "modifierMask": 0,
      "scale": 0.53,
      "type": "BUTTON",
      "zIndex": 6
    }
  ],
  "schemaVersion": 9
}
