{
  "format": "openterface.gamepad.layout.v1",
  "layout": {
    "backgroundFillArgb": -14997448,
    "backgroundOffsetX": 0.0,
    "backgroundOffsetY": 0.0,
    "backgroundPattern": "micro_grid",
    "backgroundScale": 1.0,
    "mouseSensitivity": 1.0,
    "showTwoButtons": false
  },
  "meta": {
    "displayName": "Emu 6",
    "exportedAt": "2026-05-08T20:00:00Z",
    "id": "emulator_6",
    "sourceAppVersion": "0.14"
  },
  "modules": [
    {
      "anchorX": 0.23686524,
      "anchorY": 0.5118918,
      "dpadCrossArmDecoration": "labels",
      "dpadVariant": "cross",
      "id": "stick_left",
      "moduleAccentArgb": -13154481,
      "scale": 1.43,
      "stickDownKey": 22,
      "stickLeftKey": 4,
      "stickRightKey": 7,
      "stickUpKey": 26,
      "type": "DPAD",
      "zIndex": 0
    },
    {
      "anchorX": 0.54679525,
      "anchorY": 0.32726818,
      "buttonCornerRadiusNorm": 1.0,
      "displayLabel": "K",
      "displayLabelColorArgb": -1,
      "hidKey": 24,
      "id": "button_a",
      "mappedKeyLabelVisible": false,
      "modifierMask": 0,
      "moduleAccentArgb": -20443,
      "scale": 1.43,
      "type": "BUTTON",
      "zIndex": 1
    },
    {
      "anchorX": 0.7205549,
      "anchorY": 0.33389398,
      "buttonCornerRadiusNorm": 1.0,
      "displayLabel": "S",
      "displayLabelColorArgb": -1,
      "hidKey": 12,
      "id": "button_b",
      "mappedKeyLabelVisible": false,
      "modifierMask": 0,
      "moduleAccentArgb": -43230,
      "scale": 1.43,
      "type": "BUTTON",
      "zIndex": 6
    },
    {
      "anchorX": 0.5425237,
      "anchorY": 0.71703327,
      "buttonCornerRadiusNorm": 1.0,
      "displayLabel": "P",
      "displayLabelColorArgb": -1,
      "hidKey": 13,
      "id": "button_2",
      "mappedKeyLabelVisible": false,
      "modifierMask": 0,
      "moduleAccentArgb": -11684126,
      "scale": 1.43,
      "type": "BUTTON",
      "zIndex": 7
    },
    {
      "anchorX": 0.90897244,
      "anchorY": 0.3411618,
      "buttonCornerRadiusNorm": 1.0,
      "displayLabel": "Hs",
      "displayLabelColorArgb": -1,
      "hidKey": 18,
      "id": "button_3",
      "mappedKeyLabelVisible": false,
      "modifierMask": 0,
      "moduleAccentArgb": -14575807,
      "scale": 1.43,
      "type": "BUTTON",
      "zIndex": 8
    },
    {
      "anchorX": 0.90971434,
      "anchorY": 0.73552537,
      "buttonCornerRadiusNorm": 1.0,
      "displayLabel": "D",
      "displayLabelColorArgb": -1,
      "hidKey": 15,
      "id": "button_4",
      "mappedKeyLabelVisible": false,
      "modifierMask": 0,
      "moduleAccentArgb": -1499549,
      "scale": 1.43,
      "type": "BUTTON",
      "zIndex": 9
    },
    {
      "anchorX": 0.7235675,
      "anchorY": 0.7357726,
      "buttonCornerRadiusNorm": 1.0,
      "displayLabel": "Rc",
      "displayLabelColorArgb": -1,
      "hidKey": 8,
      "id": "button_5",
      "mappedKeyLabelVisible": false,
      "modifierMask": 0,
      "moduleAccentArgb": -11751600,
      "scale": 1.43,
      "type": "BUTTON",
      "zIndex": 10
    }
  ],
  "schemaVersion": 9
}
