{
  "format": "openterface.gamepad.layout.v1",
  "layout": {
    "backgroundOffsetX": 0.0,
    "backgroundOffsetY": 0.0,
    "backgroundScale": 1.0,
    "faceButtonTemplate": "xbox_abxy",
    "mouseSensitivity": 1.0,
    "showTwoButtons": false
  },
  "meta": {
    "displayName": "XYAB Trackpad",
    "exportedAt": "2026-05-08T22:00:00Z",
    "id": "preset_pack_xyab_touchpad",
    "sourceAppVersion": "0.14"
  },
  "modules": [
    {
      "anchorX": 0.205,
      "anchorY": 0.5,
      "id": "stick_left",
      "moduleAccentArgb": -13154481,
      "scale": 1.15,
      "stickDownKey": 81,
      "stickLeftKey": 80,
      "stickRightKey": 79,
      "stickUpKey": 82,
      "type": "STICK_KEY",
      "zIndex": 0
    },
    {
      "anchorX": 0.795,
      "anchorY": 0.388,
      "buttonCornerRadiusNorm": 1.0,
      "displayLabel": "Y",
      "hidKey": 24,
      "id": "button_y",
      "mappedKeyLabelVisible": false,
      "modifierMask": 0,
      "moduleAccentArgb": -20443,
      "scale": 1.28,
      "type": "BUTTON",
      "zIndex": 1
    },
    {
      "anchorX": 0.688,
      "anchorY": 0.515,
      "buttonCornerRadiusNorm": 1.0,
      "displayLabel": "X",
      "hidKey": 11,
      "id": "button_x",
      "mappedKeyLabelVisible": false,
      "modifierMask": 0,
      "moduleAccentArgb": -14575807,
      "scale": 1.28,
      "type": "BUTTON",
      "zIndex": 2
    },
    {
      "anchorX": 0.902,
      "anchorY": 0.515,
      "buttonCornerRadiusNorm": 1.0,
      "displayLabel": "B",
      "hidKey": 12,
      "id": "button_b",
      "mappedKeyLabelVisible": false,
      "modifierMask": 0,
      "moduleAccentArgb": -43230,
      "scale": 1.28,
      "type": "BUTTON",
      "zIndex": 3
    },
    {
      "anchorX": 0.795,
      "anchorY": 0.642,
      "buttonCornerRadiusNorm": 1.0,
      "displayLabel": "A",
      "hidKey": 13,
      "id": "button_a",
      "mappedKeyLabelVisible": false,
      "modifierMask": 0,
      "moduleAccentArgb": -11684126,
      "scale": 1.28,
      "type": "BUTTON",
      "zIndex": 4
    },
    {
      "anchorX": 0.5,
      "anchorY": 0.268,
      "heightNorm": 0.25,
      "id": "touchpad_1",
      "moduleAccentArgb": -13154481,
      "scale": 1.0,
      "type": "TOUCHPAD",
      "widthNorm": 0.3,
      "zIndex": 5
    },
    {
      "anchorX": 0.435,
      "anchorY": 0.498,
      "displayLabel": "L",
      "id": "mouse_btn_l",
      "mouseButton": 1,
      "scale": 0.62,
      "type": "MOUSE_BUTTON",
      "zIndex": 6
    },
    {
      "anchorX": 0.565,
      "anchorY": 0.498,
      "displayLabel": "R",
      "id": "mouse_btn_r",
      "mouseButton": 3,
      "scale": 0.62,
      "type": "MOUSE_BUTTON",
      "zIndex": 7
    },
    {
      "anchorX": 0.418,
      "anchorY": 0.108,
      "displayLabel": "Select",
      "hidKey": 20,
      "id": "button_select",
      "modifierMask": 0,
      "scale": 0.75,
      "type": "BUTTON",
      "zIndex": 8
    },
    {
      "anchorX": 0.582,
      "anchorY": 0.108,
      "buttonCornerRadiusNorm": 1.0,
      "displayLabel": "Start",
      "hidKey": 8,
      "id": "button_start",
      "modifierMask": 0,
      "scale": 0.75,
      "type": "BUTTON",
      "zIndex": 9
    },
    {
      "anchorX": 0.41,
      "anchorY": 0.792,
      "dpadCrossArmDecoration": "labels",
      "dpadVariant": "cross",
      "id": "stick_left_2",
      "moduleAccentArgb": -13154481,
      "scale": 1.15,
      "stickDownKey": 22,
      "stickLeftKey": 4,
      "stickRightKey": 7,
      "stickUpKey": 26,
      "type": "DPAD",
      "zIndex": 10
    },
    {
      "anchorX": 0.59,
      "anchorY": 0.792,
      "id": "stick_left_3",
      "moduleAccentArgb": -13154481,
      "scale": 1.15,
      "stickDownKey": 22,
      "stickLeftKey": 4,
      "stickMouseSensitivity": 1.0,
      "stickPointerCenterMouseMask": 1,
      "stickRightKey": 7,
      "stickUpKey": 26,
      "type": "STICK_MOUSE",
      "zIndex": 11
    }
  ],
  "schemaVersion": 7
}